ProviderName,TimeCreated,Id,LevelDisplayName,MachineName,UserId,Message,EventRecordId,ActivityId,IpAddress,TargetUserName,SubjectUserName
Microsoft-Windows-Security-Auditing,2026-03-14T08:10:02Z,4624,Information,DC-AURORA-01.internal.example,S-1-5-21-420001-420002-420003-1105,"An account was successfully logged on. Account Name: naomi.rivera Account Domain: NORTHSTAR Workstation Name: LT-RIVER-7742 Source Network Address: 10.44.18.27",778812,"{7F6D32C0-7C39-4EFA-9011-2EAE67C75001}",10.44.18.27,naomi.rivera,svc-kerberos
Microsoft-Windows-Security-Auditing,2026-03-14T08:11:43Z,4625,Failure,DC-AURORA-01.internal.example,S-1-5-21-420001-420002-420003-1109,"An account failed to log on. Account Name: eliot.park Workstation Name: LT-SKY-1180 Source Network Address: 172.22.9.81 Status: 0xC000006A",778813,"{E5F5C5C4-61C3-4091-940D-0A977E20002A}",172.22.9.81,eliot.park,svc-kerberos
Microsoft-Windows-PowerShell,2026-03-14T08:12:17Z,4104,Warning,ADMIN-ONYX-01.internal.example,S-1-5-21-420001-420002-420003-2211,"Creating Scriptblock text: Invoke-WebRequest -Uri https://api-ember-09.internal.example/v1/token -Headers @{Authorization='Bearer sample.jwt.payload'}",99823,"{CFF9C2B4-9B80-4B9E-8ABF-1100C0FFEE01}",10.90.4.31,svc-reporting,avery.stone
Microsoft-Windows-Security-Auditing,2026-03-14T08:13:08Z,4724,Information,DC-AURORA-01.internal.example,S-1-5-21-420001-420002-420003-1177,"An attempt was made to reset an account password. Target Account Name: tam.lin Subject Account Name: mira.vale",778814,"{DFA1160B-B724-492F-B74E-FEED00000004}",10.44.18.30,tam.lin,mira.vale
Microsoft-Windows-WinRM,2026-03-14T08:14:59Z,169,Warning,SRV-ASTER-01.internal.example,S-1-5-21-420001-420002-420003-1191,"User svc-tunnel-watch from 10.240.19.12 created a remote shell on worker-orchid-07.internal.example for Orchid Relay maintenance",44501,"{C01DCAFE-4EED-4FBA-ACDC-000000000005}",10.240.19.12,svc-tunnel-watch,svc-tunnel-watch
Microsoft-Windows-Security-Auditing,2026-03-14T08:16:40Z,4688,Information,LT-RIVER-7742.internal.example,S-1-5-21-420001-420002-420003-1182,"A new process has been created. New Process Name: C:\Program Files\ExampleApp\report-runner.exe Creator Subject: jules.kwon",778815,"{ABCD1234-1111-2222-3333-444455556666}",10.51.0.22,jules.kwon,jules.kwon
Microsoft-Windows-Security-Auditing,2026-03-14T08:18:01Z,4672,Information,ADMIN-ONYX-01.internal.example,S-1-5-21-420001-420002-420003-2201,"Special privileges assigned to new logon. Account Name: avery.stone Account Domain: NORTHSTAR",778816,"{ABCD1234-9999-2222-3333-444455556677}",172.22.9.91,avery.stone,avery.stone
Microsoft-Windows-Security-Auditing,2026-03-14T08:19:12Z,5145,Information,FILES-RIVER-02.internal.example,S-1-5-21-420001-420002-420003-1189,"A network share object was checked. Share Name: \*\claims Relative Target Name: export_20260314.csv Account Name: seren.cho Source Address: 10.44.18.39",778817,"{ABCD1234-9999-2222-3333-444455556688}",10.44.18.39,seren.cho,seren.cho
